{
  "schema": "rbot.classroom.door.v1",
  "event": "in",
  "session_id": "S-20260926T094216Z-0004",
  "rid": "ЯID-0004-ZYZ0",
  "name": "ЯBAT",
  "role": "professor",
  "at": "2026-09-26T09:42:16Z",
  "surface": "agent-box",
  "scan": {
    "result": "recognized",
    "method": "cli"
  },
  "purpose": "Decider catch-up session 2026-09-26"
}
