{
  "schema": "rbot.classroom.door.v1",
  "event": "in",
  "session_id": "S-20260926T035842Z-0004",
  "rid": "ЯID-0004-ZYZ0",
  "name": "ЯBAT",
  "role": "professor",
  "at": "2026-09-26T03:58:42Z",
  "surface": "agent-box",
  "scan": {
    "result": "recognized",
    "method": "cli"
  },
  "purpose": "Build the door scanner, ЯID roster, door log and REGISTER as a proposal PR for the Decider"
}
