{
  "schema": "rbot.classroom.door.v1",
  "event": "in",
  "session_id": "S-20260926T094215Z-0002",
  "rid": "ЯID-0002-PQ2Q",
  "name": "ЯBOT",
  "role": "learner",
  "at": "2026-09-26T09:42:15Z",
  "surface": "app",
  "scan": {
    "result": "recognized",
    "method": "cli"
  },
  "purpose": "Decider catch-up session 2026-09-26"
}
