{
  "schema": "rbot.classroom.door.v1",
  "event": "in",
  "session_id": "S-20260926T094216Z-0005",
  "rid": "ЯID-0005-KM02",
  "name": "SCOUT",
  "role": "teacher",
  "at": "2026-09-26T09:42:16Z",
  "surface": "app",
  "scan": {
    "result": "recognized",
    "method": "cli"
  },
  "purpose": "Decider catch-up session 2026-09-26"
}
